APPLICATION NUMBER,GRANT PROJECT ID,PROJECT NAME,Grant Type,application_date,award_dt,Comments213-8005,11488,Testing a Stream Function Assessment Methodology for Oregon,Technical Assistance,01-Mar-13,18-Mar-13,27-14-001,11477,Upper Grande Ronde Spring Development,Restoration,20-Mar-14,01-Jul-13,18-14-018,11476,Upper Homestead Spring Development,Restoration,20-Jun-14,01-Jul-13,18-14-005,11475,Newsome Creek Restoration Project,Restoration,09-Jun-14,01-Jul-13,28-14-014,11473,Rock Creek Bank Stabilization,Restoration,02-Jun-14,01-Jul-13,28-14-011,11471,Crook Spring Development,Restoration,02-Jun-14,01-Jul-13,10-14-007,11469,Maluski Kimbirauska Manure Storage Facility,Restoration,17-Jun-14,01-Jul-16,08-14-002,11468,Day Upland Water Quality Project,Restoration,08-May-14,01-Jul-13,03-14-002,11467,Wolf Creek Stream Restoration,Restoration,17-Apr-14,01-Jul-13,214-8011,11466,SageCon Plan Completion and Implementation,Technical Assistance,01-Apr-14,29-Apr-14,214-8004,11465,Deer Creek Streamflow Restoration Phase 1,Restoration,22-Apr-13,01-Jul-13,214-8011,11464,"All Lands, All Threats Plan and Implementation for Sage Grouse",Technical Assistance,01-Apr-14,29-Apr-14,24-14-009,11461,Turner Creek Dirt Ditch Piping,Restoration,21-Mar-14,01-Jul-13,18-14-019,11454,Eagle Creek Juniper Restoration,Restoration,20-May-14,01-Jul-13,16-14-059,11453,K. King Brush Management,Restoration,10-Jun-14,01-Jul-13,16-14-058,11452,L. Coelsch Spring Development,Restoration,10-Jun-14,01-Jul-13,16-14-057,11451,L. von Borstel Terrace Reshape,Restoration,10-Jun-14,01-Jul-13,11-14-009,11450,Van Duzer Corridor Oak Restoration,Restoration,15-Apr-14,01-Jul-13,06-14-002,11449,West Fork Williams Creek Restoration,Restoration,14-Mar-14,01-Jul-13,26-14-010,11448,Kilkenny Pasture Enhancement,Restoration,14-May-14,01-Jul-13,21-14-011,11447,Boersma Ditch Piping,Restoration,17-Mar-14,01-Jul-13,18-14-011,11446,South Horse Heaven Upland Improvement,Restoration,12-May-14,01-Jul-13,18-14-009,11445,Young's Wildlife Habitat,Restoration,10-Mar-14,01-Jul-13,04-14-002,11444,DeCaires Manure Management,Restoration,06-May-14,01-Jul-13,04-14-001,11443,Montgomery Off-channel Watering and Restoration,Restoration,06-May-14,01-Jul-13,214-3999,11442,Willamette SIP Partnership Collaborative Project,Technical Assistance,22-Apr-13,01-Jul-13,12-14-004,11440,Rusk/Lake Roads Neighborhood Restoration,Restoration,03-Apr-14,01-Jul-13,20-14-012,11439,Micke Ranch Overland Erosion Control & Pond Spillway Stablization,Restoration,31-Mar-14,01-Jul-13,15-14-054,11438,Alley Direct Seed Conservation,Restoration,13-May-14,01-Jul-13,16-14-054,11437,N. Smith Upland Cross Fence,Restoration,13-May-14,01-Jul-13,214-2051,11436,Sullivan Gulch Bottomland Restoration - PE,Restoration,21-Oct-13,29-Apr-14,Do Not Map - PE20-14-011,11435,Shine Brothers Ranch Juniper Treatment ,Restoration,31-Mar-14,01-Jul-13,20-14-010,11434,Albertson Upland Enhancement Project,Restoration,31-Mar-14,01-Jul-13,09-14-001,11433,Marys River Riparian Planting,Restoration,01-May-14,01-Jul-13,27-14-006`,11432,Klages-Stilson Alternative Livestock Water,Restoration,20-Mar-14,01-Jul-14,214-3999,11431,Willamette Within Our Reach,Technical Assistance,22-Apr-13,01-Jul-13,05-14-005,11430,Azevedo-Kruetzer AgWQ Restoration,Restoration,05-Mar-14,01-Jul-13,16-14-010,11429,Buckhorn Spring Development,Restoration,28-Apr-14,01-Jul-13,20-14-006,11428,Fern Juniper Cut,Restoration,31-Mar-14,01-Jul-13,11-14-010,11427,Skid Creek Fish Passage,Restoration,15-Apr-14,01-Jul-13,20-14-004,11426,Leeham Flood Irrigation,Restoration,31-Mar-14,01-Jul-13,214-8004,11425,WWRI Strategic Review & Program Management,Technical Assistance,22-Apr-13,01-Jul-13,27-14-004,11424,Yost Alternative Water,Restoration,20-Mar-14,01-Jul-13,11-14-008,11422,Muddy Valley Wildlife Planting,Restoration,15-Apr-14,01-Jul-13,27-14-005,11420,Childers Alternative Water,Restoration,20-Mar-14,01-Jul-13,27-14-007,11419,Wallowa River/6-Ranch GMP,Restoration,20-Mar-14,01-Jul-13,06-14-001,11418,Grady Westfall Riparian Improvement,Restoration,14-Mar-14,01-Jul-13,20-14-009,11417,Upper Sycan Juniper Treatment,Restoration,18-Mar-14,01-Jul-13,214-8200,11408,Water Acquisition Grant - Pilot Pgm,Acquisition,01-Apr-14,29-Apr-14,214-3032,11263,Thousand Acres Floodplain Restoration Project - PE,Restoration,21-Oct-13,29-Apr-14,PE - Do not Map214-3054,11262,Plants for People: Bringing Traditional Ecological Knowledge to Restoration - PE,Restoration,21-Oct-13,29-Apr-14,PE - Do not Map214-3045,11261,Smithfield Oak Restoration - PE,Restoration,21-Oct-13,29-Apr-14,PE - Do not Map208-1061,11234,Salmon River Boat Basin and Mink Creek Restoration,Restoration,22-Jun-07,20-Mar-08,Grant Application not online214-1025,11232,Five Rivers Subbasin Restoration LFA Prescriptions Phase I - PE,Restoration,21-Oct-13,29-Apr-14,PE - Do not Map214-1031,11224,Fiddle & Morris Creeks Riparian Restoration - PE,Restoration,21-Oct-13,29-Apr-14,PE - Do not Map214-1030,11223,Grant Creek Stream and Wetland Restoration,Restoration,21-Oct-13,29-Apr-14,PE for 10963 - Do not Map214-8006,11211,Building Statewide Partnerships for Conservation & Restoration,Technical Assistance,22-Apr-13,10-Sep-13,2014-27-450,11204,Lower Deschutes Weed Control Project,Restoration,12-Dec-13,21-Mar-14,Weed Grant2014-27-484,11202,Ross Island Habitat Enhancement Project,Restoration,12-Dec-13,21-Mar-14,Weed Grant2014-27-482,11200,Wheeler SWCD EDRR,Restoration,12-Dec-13,21-Mar-14,Weed Grant2014-27-481,11199,John Day River Leafy Spurge Prevention,Restoration,12-Dec-13,21-Mar-14,Weed Grant2014-27-480,11198,Portland Garlic Mustard Control,Restoration,12-Dec-13,21-Mar-14,Weed Grant2014-27-479,11197,Wallowa Canyonlands Skeletonweed and Bugloss Control,Restoration,12-Dec-13,21-Mar-14,Weed Grant2014-27-478,11196,Wallowa Canyonlands Meadow Hawkweed Control ,Restoration,12-Dec-13,21-Mar-14,Weed Grant2014-27-477,11195,Lower Valley Invasive Weed Control,Restoration,12-Dec-13,21-Mar-14,Weed Grant2014-27-476,11194,Wallowa County Yellow Flag Iris,Restoration,12-Dec-13,21-Mar-14,Weed Grant2014-27-474,11192,Umatilla County Garlic Mustard Control,Restoration,12-Dec-13,21-Mar-14,Weed Grant2014-27-473,11191,Tualatin Basin Garlic Mustard/Giant Hogweed,Restoration,12-Dec-13,21-Mar-14,Weed Grant2014-27-472,11190,Hells Canyon Area Invasive Weed Control,Restoration,12-Dec-13,21-Mar-14,Weed Grant2014-27-471,11189,Burnt Powder Subbasin Invasive Weed Control,Restoration,12-Dec-13,21-Mar-14,Weed Grant2014-27-470,11188,Grande Ronde Weed Control,Restoration,12-Dec-13,21-Mar-14,Weed Grant2014-27-467,11185,Siuslaw Basin Knotweed Control 2014,Restoration,12-Dec-13,21-Mar-14,Weed Grant2014-27-466,11184,Scappoose Creek Garlic Mustard Treatment,Restoration,12-Dec-13,21-Mar-14,Weed Grant2014-27-465,11183,Rogue Basin Garlic Mustard Treatment,Restoration,12-Dec-13,21-Mar-14,Weed Grant2014-27-464,11182,Aquatic Weed EDRR,Restoration,12-Dec-13,21-Mar-14,Weed Grant2014-27-463,11181,Jordan Valley Weed Control,Restoration,12-Dec-13,21-Mar-14,Weed Grant2014-27-462,11180,Biological Control of Gorse,Restoration,12-Dec-13,21-Mar-14,Weed Grant2014-27-460,11178,The Whychus Floodplain Knapweed Control Project,Restoration,12-Dec-13,21-Mar-14,Weed Grant212-8004,11177,Upper West Fork Hood River Restoration,Restoration,18-Apr-11,14-Sep-11,18-14-015,11176,Section 11 Creek Elk Habitat,Restoration,10-Sep-13,01-Jul-13,28-14-001,11175,Wolf Creek Pivot Conversion,Restoration,10-Dec-13,01-Jul-13,18-14-017,11173,Sage Hollow Wildlife Watering System,Restoration,11-Feb-14,01-Jul-13,2014-27-457,11171,Cottonwood Basin Bio-Control,Restoration,12-Dec-13,21-Mar-14,Weed Grant2014-27-456,11170,Middle Fork Willamette Knotweed Control Project,Restoration,12-Dec-13,21-Mar-14,Weed Grant2014-27-454,11166,Willow Creek Basin Leafy Spurge Project,Restoration,12-Dec-13,21-Mar-14,Weed Grant2014-27-453,11165,Malheur Rush Skeletonweed Containment Project,Restoration,12-Dec-13,21-Mar-14,Weed Grant2014-27-451,11163,Kincaid's Lupine release / Oak Savanna restoration,Restoration,12-Dec-13,21-Mar-14,Weed Grant2014-27-449,11162,Bear Creek Subwatershed Floodplain Wetland Restoration,Restoration,12-Dec-13,21-Mar-14,Weed Grant2014-27-445,11158,Lincoln County Upland Noxious Weed Control,Restoration,12-Dec-13,21-Mar-14,Weed Grant2014-27-443,11156,Warner Valley Perennial Pepperweed Treatment Strategy,Restoration,12-Dec-13,21-Mar-14,Weed Grant2014-27-442,11155,Goose Lake Basin Dyer's Woad Control,Restoration,12-Dec-13,21-Mar-14,Weed Grant2014-27-440,11153,Dusenbury Spotted knapweed Control,Restoration,12-Dec-13,21-Mar-14,Weed Grant2014-27-438,11150,Eurasian Watermilfoil Control at Howard Prairie Lake and Pacifica Gardens ,Restoration,12-Dec-13,21-Mar-14,Weed Grant2014-27-437,11149,Protecting rare butterfly resources from invasives,Restoration,12-Dec-13,21-Mar-14,Weed Grant2014-27-436,11148,Hood River Garlic Mustard Abatement Project     ,Restoration,12-Dec-13,21-Mar-14,Weed Grant2014-27-435,11147,Harney Valley African rue VI,Restoration,12-Dec-13,21-Mar-14,Weed Grant2014-27-433,11145,Poison Creek Spotted Knapweed Follow-up,Restoration,12-Dec-13,21-Mar-14,Weed Grant2014-27-432,11144,The Now Happy Valley Project Part 2 ,Restoration,12-Dec-13,21-Mar-14,Weed Grant2014-27-431,11143,County Wide Perennial Pepperweed Project,Restoration,12-Dec-13,21-Mar-14,Weed Grant2014-27-430,11142,John Day River Yellow Flag Iris,Restoration,12-Dec-13,21-Mar-14,Weed Grant2014-27-429,11141,Upper  John Day Mediterranean Sage Project,Restoration,12-Dec-13,21-Mar-14,Weed Grant2014-27-427,11139,Plumeless Thistle Project,Restoration,12-Dec-13,21-Mar-14,Weed Grant2014-27-426,11138,Squarrose Knapweed Project,Restoration,12-Dec-13,21-Mar-14,Weed Grant2014-27-425,11137,Ferry Canyon/Thirtymile Creek IWMA,Restoration,12-Dec-13,21-Mar-14,Weed Grant2014-27-424,11136,Lower John Day  IWMA,Restoration,12-Dec-13,21-Mar-14,Weed Grant2014-27-417,11134,Deschutes Orange Hawkweed 2014,Restoration,21-Oct-13,21-Mar-14,Weed Grant2014-27-421,11131,Portuguese broom and gorse control -2014,Restoration,12-Dec-13,21-Mar-14,Weed Grant2014-27-420,11130,Distaff Thistle/ Paterson’s Curse Control-2014,Restoration,12-Dec-13,21-Mar-14,Weed Grant2014-27-415,11127,Oh My Gorse!,Restoration,12-Dec-13,21-Mar-14,Weed Grant2014-27-413,11125,No Not Knotweed!,Restoration,12-Dec-13,21-Mar-14,Weed Grant2014-27-412,11124,Illinois River Knotweed Project     ,Restoration,12-Dec-13,21-Mar-14,Weed Grant2014-27-411,11123,Central Oregon Top Weed Phase II,Restoration,12-Dec-13,21-Mar-14,Weed Grant2014-27-410,11122,Lower Crooked River Scotch Thistle Project,Restoration,12-Dec-13,21-Mar-14,Weed Grant2014-27-409,11121,Coos Watershed Cooperative Weed Control Phase III,Restoration,12-Dec-13,21-Mar-14,Weed Grant2014-27-407,11119,The Dalles Uplands Weed Control,Restoration,12-Dec-13,21-Mar-14,Weed Grant2014-27-406,11118,Coast Fork Knotweed Project Phase I ,Restoration,12-Dec-13,21-Mar-14,Weed Grant2014-27-405,11117,Clatsop Riparian and Aquatic Weed Control,Restoration,21-Oct-13,21-Mar-14,Weed Grant2014-27-404,11116,Clatsop Upland Weed Control,Restoration,12-Dec-13,21-Mar-14,Weed Grant2014-27-403,11115,City of Eugene Ludwigia Control Project,Restoration,21-Oct-13,21-Mar-14,Weed Grant2014-27-402,11114,Gorse Removal at Washburne State Park,Restoration,12-Dec-13,21-Mar-14,Weed Grant2014-27-400,11112,Willamette River Aquatic Weed Management Project  ,Restoration,12-Dec-13,21-Mar-14,Weed Grant25-14-010,11111,Wilson Wildlife Watering System,Restoration,23-Jan-14,01-Jul-13,28-14-003,11107,Puzzle Creek Spring Development,Restoration,10-Dec-13,01-Jul-13,28-14-002,11100,Martin Off-stream Water,Restoration,10-Dec-13,01-Jul-13, 22-14-004,11099,Natural Corral Creek Riparian Stabilization,Restoration,13-Dec-13,01-Jul-13, 214-9906,11097,Whycus Creek additonal funding ,Acquisition,28-Jan-14,28-Jan-14,23-14-005,11094,Shoestring Irrigation Efficiency,Restoration,11-Dec-13,01-Jul-13, 18-14-002,11092,Lower Johnson Creek Fuels Reduction,Restoration,09-Dec-13,01-Jul-13, 210-920,11089,Upper Klamath Basin Water Leasing Funding Pgm,Acquisition,01-Sep-09,15-Sep-09, 16-14-053,11088,Smith Solar Development,Restoration,10-Dec-13,01-Jul-13, 15-14-001,11078,Birch Creek Water Trough,Restoration,08-Dec-13,01-Jul-13, 17-14-001,11076,Blizzard Ridge Juniper Treatment,Restoration,05-Dec-13,01-Jul-13, 23-14-001,11074,Kingman Irrigation Efficiency,Restoration,11-Dec-13,01-Jul-13, 11-14-005,11071,Brewster Raptor Habitat Project,Restoration,15-Oct-13,01-Jul-13, 10-14-001,11067,Soda Springs Oak Woodland Restoration,Restoration,15-Nov-13,01-Jul-13, 25-14-004,11064,Keyes Creek Cross Fence,Restoration,31-Oct-13,01-Jul-13, 25-14-007,11063,Thomas Juniper Removal,Restoration,31-Oct-13,01-Jul-13, 214-8008,11060,Ashland Cross-boundary Forest Restoration,Technical Assistance,26-Nov-13,04-Nov-13, 214-8008,11058,Deschutes Collaborative Forest Landscape Restoration Project,Technical Assistance,26-Nov-13,04-Nov-13, 214-8008,11056,Umatilla Collaborative Capacity,Technical Assistance,26-Nov-13,04-Nov-13, 214-8008,11054,Issue-based Innovation Project,Technical Assistance,26-Nov-13,04-Nov-13, 214-8008,11053,Wolf Creek Forest Monitoring Program,Technical Assistance,26-Nov-13,04-Nov-13, 214-8008,11052,Wallowa-Whitman Forest Collaborative - Implementation Phase 2,Technical Assistance,26-Nov-13,04-Nov-13, 19-14-001,11049,AID Noxious Weeds - Native Grasses,Restoration,08-Nov-13,01-Jul-13, 25-14-008,11048,Donnelly Basin Juniper Removal,Restoration,31-Oct-13,01-Jul-13, 25-14-006,11047,Haystack Creek Juniper Removal,Restoration,31-Oct-13,01-Jul-13, 25-14-003,11046,Cottonwood Creek Juniper Removal,Restoration,31-Oct-13,01-Jul-13, 15-14-052,11044,Wilson Spring Development,Restoration,12-Nov-13,01-Jul-13, 21-14-006,11042,Peacore Stukel Juniper Removal Phase II,Restoration,18-Sep-13,01-Jul-13, 21-14-001,11041,Mathis Stukel Juniper Removal Phase II,Restoration,18-Sep-13,01-Jul-13, 18-14-016,11040,Teaters Basin Weed Extermination,Restoration,15-Oct-13,01-Jul-13, 01-14-003,11039,St Helens High School Greenhouse,Restoration,25-Oct-13,01-Jul-13, 11-14-006,11036,Audubon Reserve Erosion Project,Restoration,15-Oct-13,01-Jul-13, 11-14-001,11034,Lower Salt Creek Upland Restoration,Restoration,15-Oct-13,01-Jul-13, 15-14-051,11033,Reckmann Spring Development,Restoration,29-Oct-13,01-Jul-13, 22-14-002,11032,Steens - MDI Juniper Removal,Restoration,23-Oct-13,01-Jul-13, 22-14-001,11031,Riddle Ranch - MDI Juniper Removal,Restoration,23-Oct-13,01-Jul-13, 22-14-003,11030,Mahon Creek - MDI Riparian Treatment,Restoration,23-Oct-13,01-Jul-13, 13-14-001,11029,Marquam Headwaters Forest Restoration,Restoration,27-Sep-13,01-Jul-13, 11-14-002,11028,West Perrydale Oak Prairie Restoration (phase 1),Restoration,15-Oct-13,01-Jul-13, 13-14-002,11026,Sanchez Riparian Restoration,Restoration,27-Sep-13,01-Jul-13, 13-14-003,11025,Brandt Oak Woodland Restoration,Restoration,27-Sep-13,01-Jul-13, 18-14-006,11023,Eagle Rock Range Recovery,Restoration,01-Aug-13,01-Jul-13, 13-14-007,11022,Rock Creek Forest Restoration: Varma,Restoration,27-Sep-13,01-Jul-13, 214-9904,11014,Hayden Island,Acquisition,21-Oct-13,29-Apr-14,214-9902,11012,Mill Creek Ridge Oak Savanna,Acquisition,21-Oct-13,29-Apr-14,214-9900,11010,Joyce Carnegie Trust Property,Acquisition,21-Oct-13,29-Apr-14,214-7000,11009,StatNat Ecological and Environmental Statistics Support,Monitoring,21-Oct-13,29-Apr-14,13-14-004,10813,"Winkler Riparian, Upland Habitat Improvement",Restoration,27-Sep-13,01-Jul-13, 13-14-006,10811,Quail Hollow West HOA Enhancement,Restoration,27-Sep-13,01-Jul-13, 13-14-005,10810,Summer Creek Headwaters Restoration at Murrayhill,Restoration,27-Sep-13,01-Jul-13, 214-8100,10804,Douglas County CREP Technical Assistance,Technical Assistance,30-Sep-13,10-Sep-13, 214-8100,10801,Marion-Yamhill Riparian Partnership,Technical Assistance,30-Sep-13,10-Sep-13, 214-8100,10800,Upper Willamette Regional CREP Partnership Years 3 & 4,Technical Assistance,30-Sep-13,10-Sep-13, 214-8100,10799,Wheeler County CREP TA,Technical Assistance,30-Sep-13,10-Sep-13, 214-8100,10798,Gilliam County CREP Technical Assistance,Technical Assistance,30-Sep-13,10-Sep-13, 214-8100,10797,Coos-Curry CREP TA 2014-15,Technical Assistance,30-Sep-13,10-Sep-13, 214-8100,10796,Upper Klamath and Jackson County CREP,Technical Assistance,30-Sep-13,10-Sep-13, 214-8100,10795,Sherman County Riparian Buffer Enhancement,Technical Assistance,30-Sep-13,10-Sep-13, 214-8100,10794,Central Oregon Tri-County CREP Program,Technical Assistance,30-Sep-13,10-Sep-13, 214-8100,10793,Wasco County Riparian Buffers,Technical Assistance,30-Sep-13,10-Sep-13, 214-8100,10792,Northeastern Oregon CREP Technical Assistance,Technical Assistance,30-Sep-13,10-Sep-13, 16-14-051,10777,Thompson Upland Terrace Rebuild,Restoration,10-Sep-13,01-Jul-13,214-8006,10776,NOWC & OACD funding Sept 13 thru Sept 14,Technical Assistance,22-Apr-13,10-Sep-13, 214-903,10762,Rogue River Watershed Councils Consolidation,Technical Assistance,22-Apr-13,01-Jul-13,213-1053,10723,Miami River (Tillamook) Restoration - PE,Restoration,22-Apr-13,11-Jun-13,PE - Do not Map213-8002,10719,Westwind Baseline Inventory Documentation,Acquisition,01-Jan-13,17-Jan-13,214-3999,10716,Marys River Model Watershed Riparian Corridor and Related Floodplain Enhancement - PE,Restoration,22-Apr-13,01-Jul-13,PE - Do not Map214-3999,10715,Calapooia Santiam Riparian Revegetation - Phase 3 (2013-2015) - PE,Restoration,22-Apr-13,01-Jul-13,PE - Do not Map214-3999,10712,Upper Luckiamute Riparian Fencing and Revegetation - PE,Restoration,22-Apr-13,01-Jul-13,PE - Do not Map212-101,10662,Bald Hill Farm Acq Direct costs,Acquisition,18-Apr-11,18-Mar-13,212-108,10661,Pugh Property Acquisition direct costs,Acquisition,18-Apr-11,17-Jan-13,213-8002,10604,Yaquina Baseline Documentation and Management Plans,Acquisition,01-Jan-13,17-Jan-13,213-8002,10603,Alsea Management Plans,Acquisition,01-Jan-13,17-Jan-13,213-1053,10602,Miami River (Tillamook) Restoration,Restoration,22-Apr-13,11-Jun-13, 212-4888,10582,SF Sprague - Keystone Reach Landowner Agreements,Technical Assistance,19-Jan-12,19-Jan-12,212-916,10567,Deming Creek Water Rights Valuation (214-100),Technical Assistance,18-Apr-11,14-Sep-11,213-8002,10555,Nature Conservancy Baseline Inventory Documentation,Acquisition,01-Jan-13,17-Jan-13,214-3027,10540,Bear Creek Stream Connectivity and Habitat Enhancement,Restoration,22-Apr-13,10-Sep-13,214-6016,10507,Bear Creek Uplands Improvement,Restoration,22-Apr-13,10-Sep-13,214-6014,10505,Mountain/Indian Creek Culverts,Restoration,22-Apr-13,10-Sep-13,214-5037,10504,Thousand Springs Riparian and Upland Restoration,Restoration,22-Apr-13,10-Sep-13,214-5035,10501,The Model to Protect Sage-Grouse - Site Specific Plan,Technical Assistance,22-Apr-13,10-Sep-13,214-5034,10500,Skull Creek Habitat Enhancement,Restoration,22-Apr-13,10-Sep-13,214-5033,10499,Harney Basin Aquatic Health-Inventory Phase I,Technical Assistance,22-Apr-13,10-Sep-13,214-6013,10498,Soda Creek Upland Habitat Improvements,Restoration,22-Apr-13,10-Sep-13, 214-5031,10482,Black Rock Water Quality Improvement,Restoration,22-Apr-13,10-Sep-13, 214-5018,10459,Miller Canyon Landscape Restoration Project,Restoration,22-Apr-13,10-Sep-13,214-100,10454,Deming Creek Flow Restoration,Acquisition,22-Apr-13,10-Sep-13,214-5015,10439,Crawdad Waterline Phase I,Restoration,22-Apr-13,10-Sep-13,214-5014,10435,Rescuing Cusick Creek's Besieged Aspen,Restoration,22-Apr-13,10-Sep-13, 214-5013,10434,The Johnny Aspenseed Project,Restoration,22-Apr-13,10-Sep-13,214-5011,10430,Planting and Protecting the Previously Pounded Powder,Restoration,22-Apr-13,10-Sep-13,214-5010,10429,Getting Groused on Goose Creek,Restoration,22-Apr-13,10-Sep-13,214-5009,10427,Jordan Valley Weed Restoration,Restoration,22-Apr-13,10-Sep-13,214-4002,10423,Christman Diversion Replacement,Restoration,22-Apr-13,10-Sep-13,214-5007,10422,Beaver Creek Dam Fish Passage,Restoration,22-Apr-13,10-Sep-13,214-4001,10419,Howard Creek Tributary Culvert Removal/Replacement Project,Restoration,22-Apr-13,10-Sep-13,214-4000,10418,Camp-Thomas Creek Fish Passage & Restoration,Restoration,22-Apr-13,10-Sep-13, 213-3048,10393,Brush Creek Habitat Restoration - PE,Restoration,22-Oct-12,18-Mar-13,PE - Do not Map213-8002,10391,Kahn Tract Baseline,Acquisition,01-Jan-13,17-Jan-13,213-1025,10385,Neahkahnie Lake Creek and Wetland Enhancement - PE,Restoration,22-Oct-12,18-Mar-13,PE - Do not Map209-104,10328,Cardwell Hill Land Acquisition Pearcy-Schoener direct costs,Acquisition,21-Apr-08,17-Jul-12,213-8002,10298,Greenbelt Land Trust Baseline and Management Plan Development,Acquisition,01-Jan-13,17-Jan-13,08-12-010,10286,WEMPLE Upland Water Quality Project,Restoration,15-Jan-13,13-Sep-11,212-915,10278,LTIS Listening Sessions facilitation Feb 2013,Technical Assistance,18-Apr-11,13-Sep-11,212-915,10268,LTIS - Listening Session Webinar,Technical Assistance,18-Apr-11,13-Sep-11,212-8100,10256,CREP Technical Assistance Training Feb 2013,Technical Assistance,17-Oct-11,14-Sep-11, 212-916,10247,Water Acquisition Valuation PSK,Technical Assistance,18-Apr-11,14-Sep-11,209-104,10229,Cardwell Hill Land Acquisition Crisp-Liddell direct costs,Acquisition,21-Apr-08,17-Jul-12,212-914,10224,Webinar funding for Council Support Listening Session 12/4/12,Outreach,18-Apr-11,13-Sep-11, 210-920,10223,MMT Within Our Reach Conference Funding,Outreach,01-Sep-09,15-Sep-09,212-107,9996,Miami Acquisitiion Direct Costs,Acquisition,18-Oct-10,19-Jan-12,Removed-Do Not Map Acq Direct Costs212-107,9995,Dooher Acquisition Direct Costs,Acquisition,18-Apr-11,19-Jan-12,Removed-Do Not Map Acq Direct Costs212-3999,9977,Harkens and Horseshoe Lakes Restoration Phase 1 - PE,Restoration,18-Apr-11,14-Sep-11,PE - Do not Map212-3999,9976,Green Island Revegetation - PE,Restoration,18-Apr-11,14-Sep-11,PE - Do not Map208-3090,9970,Mid Willamette River Floodplain Acq direct costs-Carnegie,Acquisition,01-Jan-08,19-Mar-08,Remove-Do Not Map Acq Direct Costs208-3090,9969,Mid Willamette River Floodplain Acq direct costs-Waggle,Acquisition,01-Jan-08,19-Mar-08,Remove-Do Not Map Acq Direct Costs208-3090,9968,Mid Willamette River Floodplain Acq direct costs-Stellmacher,Acquisition,01-Jan-08,19-Mar-08,Remove-Do Not Map Acq Direct Costs212-3999,9932,Luckiamute State Natural Area Enhancement - PE,Restoration,18-Apr-11,14-Sep-11,PE - Do not Map212-3999,9913,Lost Creek Riparian Corridor Enhancement Project - PE,Restoration,18-Apr-11,14-Sep-11,PE - Do not Map209-104,9904,Cardwell Hill Land Acquisition Pearcy-Schoener,Acquisition,21-Apr-08,17-Jul-12,212-4999,9897,Remund,Acquisition,18-Apr-11,14-Sep-11,210-4023,9833,Camp Polk Meadow Acq - direct costs,Acquisition,01-Jul-09,15-Sep-09,208-3090,9832,Mid Willamette River Floodplain Acq direct costs-Pitcher,Acquisition,01-Jan-08,19-Mar-08,212-3999,9827,Little Willamette Restoration Phase 2 - PE,Restoration,18-Apr-11,14-Sep-11,Do Not Map - Pe208-1061,9664,Lower Salmon River Lessons Learned Report and Crowley Creek Restoration,Restoration,22-Jun-07,20-Mar-08,212-916,9660,Long-Term Land & Water Protection Task Force Work Sessions,Technical Assistance,18-Apr-11,14-Sep-11,2012-252-19,9655,Controlling Yellow Flag Iris Phase II (2),Restoration,03-Nov-11,05-Mar-12,Weed Grant2012-252-13,9654,Harney Valley African Fue IV,Restoration,03-Nov-11,05-Mar-12,Weed Grant2012-252-28,9653,Lower John Day River Thistle Control,Restoration,03-Nov-11,05-Mar-12,Weed Grant2012-252-33,9652,Mt Wilson Watershed - Beaver Creek Project,Restoration,03-Nov-11,05-Mar-12,Weed Grant2012-252-42,9651,Lower Deschutes Weed Control and Detection,Restoration,03-Nov-11,05-Mar-12,Weed Grant2012-252-41,9650,Upper Rock Creek IWMA,Restoration,03-Nov-11,05-Mar-12,Weed Grant2012-252-45,9646,Interior DC Gorse Control- 2012,Restoration,03-Nov-11,05-Mar-12,Weed Grant2012-252-44,9645,Paterson's Curse,Restoration,03-Nov-11,05-Mar-12,Weed Grant2012-252-43,9644,Woolly Distaff Thisle Control- 2012,Restoration,03-Nov-11,05-Mar-12,Weed Grant2012-252-34,9643,Plumeless Thistle Project,Restoration,03-Nov-11,05-Mar-12,Weed Grant2012-252-39,9642,Willow Creek Basin Weed Control Project,Restoration,03-Nov-11,05-Mar-12,Weed Grant2012-252-38,9641,Lincoln SWCD Clematis Control Project,Restoration,03-Nov-11,05-Mar-12,Weed Grant2012-252-35,9634,Squarrose Knapweed Project,Restoration,03-Nov-11,05-Mar-12,Weed Grant2012-252-32,9633,Portland Garlic Mustard Control,Restoration,03-Nov-11,05-Mar-12,Weed Grant2012-252-31,9632,Warner Valley Cooperative Noxious Weed Control,Restoration,03-Nov-11,05-Mar-12,Weed Grant2012-252-23,9626,Otis Valley Noxious Weed Project,Restoration,03-Nov-11,05-Mar-12,Weed Grant2012-252-20,9625,Southern Alvord Basin Noxious Weed Project,Restoration,03-Nov-11,05-Mar-12,Weed Grant2012-252-17,9624,Harper Creek Yellow Starthistle Containment,Restoration,03-Nov-11,05-Mar-12,Weed Grant2012-252-16,9623,Alder Creek Leafy Spurge Control,Restoration,03-Nov-11,05-Mar-12,Weed Grant2012-252-14,9621,Floras Gorse 7,Restoration,03-Nov-11,05-Mar-12,Weed Grant2012-252-11,9619,Three Forks Perennial Pepperweed Project,Restoration,03-Nov-11,05-Mar-12,Weed Grant2012-252-09,9617,Ferry Canyon Creek IWMA,Restoration,03-Nov-11,05-Mar-12,Weed Grant2012-252-08,9616,Union County Whitetop Control Program,Restoration,03-Nov-11,05-Mar-12,Weed Grant2012-252-07,9615,Union County Hawkweek Control,Restoration,03-Nov-11,05-Mar-12,Weed Grant2012-252-04,9612,Jordan Valley CWMA Weed Control,Restoration,03-Nov-11,05-Mar-12,Weed Grant2012-252-02,9610,Rush Skeletonweed Reduction,Restoration,03-Nov-11,05-Mar-12,Weed Grant2012-252-36,9608,Dusenbury Spotted Knapweed Management,Restoration,03-Nov-11,05-Mar-12,Weed Grant2012-252-40,9607,Meadow Hawkweed Control- Wallowa Canyonlands Partnership,Restoration,03-Nov-11,05-Mar-12,Weed Grant210-920,9581,OWEB Listserver funding,Education,01-Sep-09,15-Sep-09,